"案件番号","大分類","小分類","案件名（事業年度・名称）","実施機関及び問い合わせ先","入札日時"
"032000-H2810261431-11","企画・広告・手配","大会・イベント企画運営","平成２８年度和歌山県の人と自然をつなぐシンポジウム運営業務委託","環境生活総務課","H28/11/15 10:00"
"070601-H2810191746-11","役務以外の資格","建設業","和歌山県林業試験場本館屋上防水修繕業務","和歌山県林業試験場","H28/11/16 13:30"
"082501-H2810201451-11","役務以外の資格","その他","平成２８年度和歌山下津港ガントリークレーン修繕業務","和歌山下津港湾事務所","H28/11/10 11:00"
"130361-H2811010936-11","森林整備等","森林整備","平成２８年度　保育　第１号−２　保育事業","伊都振興局建設部総務調整課","H28/11/22 13:30"
"500100-H2810071143-11","建築物の保守管理","建築物等の点検","平成28年度　委　第13号　和歌山商業高校外建築基準法第12条に基づく定期点検委託業務","教育庁総務課","H28/11/09 10:00"
"500100-H2810071307-11","建築物の保守管理","建築物等の点検","平成28年度　委　第14号　耐久高校外建築基準法第12条に基づく定期点検委託業務","教育庁総務課","H28/11/09 11:00"
"512400-H2810271514-11","撤去作業、凍結防止","船舶等解体","平成２８年度和歌山県立田辺高等学校焼却炉撤去処分業務委託","和歌山県立田辺高等学校","H28/11/17 10:00"
